attribute,type,required,style,units,description,options,alias
archive_id,str,TRUE,alpha numeric,none,station name that is archived {a-z;A-Z;0-9},none,none
channel_layout,str,FALSE,controlled vocabulary,none,how the station was laid out,[ L | X | other ],none
channels_recorded,str,TRUE,controlled vocabulary,none,list of components recorded by the station. Should be a summary of all channels recorded dropped channels will be recorded in Run metadata.,[ Ex | Ey | Hx | Hy | Hz | T | Battery | other | … ],none
comments,str,FALSE,free form,none,any comments on the station,none,none
data_type,str,TRUE,controlled vocabulary,none,type of data recorded. If multiple types input as a comma separated list,none,none
geographic_name,str,TRUE,free form,none,closest geographic name to the station,none,none
id,str,TRUE,free form,none,station name can be a longer name,none,none
